,topic,difficulty,obscurity,extracted_queries
2122,Epidemiology,Easy,Least,Confirmation bias occurs when epidemiologists form a hypothesis first before objectively analyzing data.
2123,Epidemiology,Easy,Least,Selection bias can affect epidemiological studies if the study groups are not representative of the target population.
2124,Epidemiology,Easy,Least,Epidemiology relies solely on controlled experiments and interventions to establish causation.
2125,Epidemiology,Easy,Least,"Epidemiologists only study infectious disease outbreaks like COVID-19, influenza and Ebola."
2126,Astronautics,Hard,Most,"The longest single human spaceflight is 438 days, 17 hours, conducted by Russian cosmonaut Valeri Polyakov."
2127,Astronautics,Hard,Most,"The farthest distance humans have traveled from Earth is 401,056 km during the Apollo 13 mission."
2128,Astronautics,Hard,Most,"The Space Shuttle Discovery flew 39 successful missions, more than any other shuttle."
2129,Astronautics,Hard,Most,"The first spacewalk was performed by Soviet cosmonaut Alexei Leonov in 1965, lasting 12 minutes and 9 seconds."
2130,Astronautics,Hard,Most,"The Apollo Lunar Module had a launch weight of 15,300 kg when fully fueled for landing on the Moon."
2131,Astronautics,Hard,Most,The Soviet space station Mir orbited the Earth for 15 years from 1986 to 2001.
2132,Astronautics,Hard,Most,The largest Hubble Space Telescope mirror is 2.4 meters in diameter.
2133,Astronautics,Hard,Most,The first American astronaut in space was Alan Shepard aboard Freedom 7 in 1961.
2134,Astronautics,Hard,Most,The Apollo 11 Lunar Module Eagle had a total crew cabin volume of 6.65 cubic meters.
2135,Astronautics,Hard,Most,"The SpaceX Falcon Heavy rocket produces 22,819 kilonewtons of thrust at liftoff."
2136,Astronautics,Hard,Most,The first animal intentionally sent into space was the dog Laika on Sputnik 2 in 1957.
2137,Astronautics,Hard,Most,Neil Armstrong was the first person to walk on the Moon during the Apollo 11 mission in 1969.
2138,Astronautics,Hard,Most,Sally Ride was the first American woman in space aboard Space Shuttle Challenger in 1983.
2139,Astronautics,Hard,Most,The Apollo 13 mission in 1970 was aborted after an oxygen tank explosion damaged the service module.
2140,Astronautics,Hard,Most,The Soviet Buran space shuttle completed one unmanned spaceflight in 1988 before the program was canceled.
2141,Astronautics,Hard,Most,The International Space Station has been continuously occupied by rotating crews since 2000.
2142,Astronautics,Hard,Most,China became the third country to independently send humans into space with Yang Liwei in 2003.
2143,Astronautics,Hard,Most,The Parker Solar Probe reached the closest approach to the Sun by any spacecraft at under 15 million km.
2144,Astronautics,Hard,Most,The SpaceX Crew Dragon is the first commercial spacecraft to take astronauts to the International Space Station.
2145,Astronautics,Hard,Most,The Apollo program's Lunar Roving Vehicle could travel at a top speed of 13 km/h on the Moon.
2146,Astronautics,Medium,Fairly,The first American woman in space was Sally Ride in 1983.
2147,Astronautics,Medium,Fairly,The Sun is approximately halfway through its lifespan as a main sequence star.
2148,Astronautics,Medium,Fairly,There are 5 dwarf planets currently recognized in our solar system.
2149,Astronautics,Medium,Fairly,The nearest star to our solar system is Alpha Centauri.
2150,Astronautics,Medium,Fairly,Gravitational waves were first directly detected in 2015.
2151,Astronautics,Medium,Fairly,The Hubble Space Telescope was launched aboard the space shuttle Discovery in 1990.
2152,Astronautics,Medium,Fairly,Mars has two natural satellites called Phobos and Deimos.
2153,Astronautics,Medium,Fairly,Astronauts on the International Space Station experience around 90% of Earth's gravity.
2154,Astronautics,Medium,Fairly,The largest known asteroid in our solar system is Vesta.
2155,Astronautics,Medium,Fairly,The Apollo 11 lunar module landed on the near side of the Moon.
2156,Astronautics,Medium,Fairly,NASA's Voyager 1 spacecraft has left the solar system and entered interstellar space.
2157,Astronautics,Medium,Fairly,Astronauts experience altered color vision in space due to fluid shifts in their eyes.
2158,Astronautics,Medium,Fairly,The primary mirror on the Hubble Space Telescope is 2.4 meters in diameter.
2159,Astronautics,Medium,Fairly,China became the third country to independently launch humans into space in 2003.
2160,Astronautics,Medium,Fairly,The first animal sent into space was the dog Laika on Sputnik 2 in 1957.
2161,Astronautics,Medium,Fairly,Scott Kelly holds the record for the longest single spaceflight by an American astronaut at 340 days.
2162,Astronautics,Medium,Fairly,Astronauts use specially designed toilets that utilize air flow to collect urine and feces in microgravity.
2163,Astronautics,Medium,Fairly,The International Space Station orbits at an altitude of approximately 250 miles.
2164,Astronautics,Medium,Fairly,Apollo astronauts brought back over 800 pounds of Moon rocks and soil to study.
2165,Astronautics,Medium,Fairly,Saturn's moon Titan has seas and lakes made up of liquid hydrocarbons like methane and ethane.
2166,Astronautics,Easy,Least,The first human spaceflight was in 1957 when the Soviet Union launched Sputnik 1.
2167,Astronautics,Easy,Least,The Apollo 11 mission in 1969 landed the first humans on the moon.
2168,Astronautics,Easy,Least,Yuri Gagarin was the first human to orbit Earth in 1961.
2169,Astronautics,Easy,Least,Sally Ride was the first American woman in space in 1983.
2170,Astronautics,Easy,Least,The International Space Station has been continuously occupied since 2000.
2171,Astronautics,Easy,Least,The Space Shuttle program flew 135 missions from 1981 to 2011.
2172,Astronautics,Easy,Least,Neil Armstrong was the first person to walk on the moon.
2173,Astronautics,Easy,Least,China has landed robotic rovers on the moon.
2174,Astronautics,Easy,Least,The Galileo spacecraft visited Jupiter and its moons in the 1990s.
2175,Astronautics,Easy,Least,The Curiosity rover landed on Mars in 2012 and is still active today.
2176,Astronautics,Easy,Least,Astronauts have conducted spacewalks outside the International Space Station.
2177,Astronautics,Easy,Least,NASA plans to return humans to the moon by 2024.
2178,Astronautics,Easy,Least,No human has traveled farther from Earth than the moon.
2179,Astronautics,Easy,Least,SpaceX has successfully landed and reused orbital rockets.
2180,Astronautics,Easy,Least,Astronauts have grown vegetables aboard the International Space Station.
2181,Astronautics,Easy,Least,China aims to complete its own space station around 2022.
2182,Astronautics,Easy,Least,The Parker Solar Probe was launched in 2018 to study the sun from close range.
2183,Astronautics,Easy,Least,Astronauts experience muscle atrophy and bone loss from extended time in microgravity.
2184,Astronautics,Easy,Least,The dwarf planet Pluto was visited by the New Horizons spacecraft in 2015.
2185,Astronautics,Easy,Least,Astronauts must exercise for several hours per day on the ISS to mitigate effects of microgravity.
2186,Creative Writing,Hard,Most,"In his play ""Waiting for Godot"", Samuel Beckett originally wrote the role of Estragon for a female actress."
2187,Creative Writing,Hard,Most,"The novel ""Moby Dick"" by Herman Melville was a commercial failure during his lifetime."
2188,Creative Writing,Hard,Most,"The first line of Leo Tolstoy's novel ""Anna Karenina"" is ""All unhappy families are unhappy in their own way."
2189,Creative Writing,Hard,Most,"The novel ""The Great Gatsby"" by F. Scott Fitzgerald takes place in New York City in the 1920s."
2190,Creative Writing,Hard,Most,"William Shakespeare's play ""Macbeth"" is based on actual historical events in 11th century Scotland."
2191,Creative Writing,Hard,Most,"Ernest Hemingway wrote the entirety of his novel ""The Sun Also Rises"" in one sitting at a cafe in Paris."
2192,Creative Writing,Hard,Most,"The dystopian novel ""1984"" by George Orwell was published in 1949."
2193,Creative Writing,Hard,Most,The fiction writer Raymond Carver was part of the Beat Generation in American literature.
2194,Creative Writing,Hard,Most,"The novel ""To Kill a Mockingbird"" by Harper Lee takes place in Mississippi during the Great Depression."
2195,Creative Writing,Hard,Most,"The poet Sylvia Plath won the Pulitzer Prize for poetry in 1982, almost 20 years after her death."
2196,Creative Writing,Hard,Most,"Ernest Hemingway wrote the entirety of ""A Farewell to Arms"" while working as an ambulance driver in Italy during World War I."
2197,Creative Writing,Hard,Most,"The novel ""The Catcher in the Rye"" by J.D. Salinger takes place over just two days."
2198,Creative Writing,Hard,Most,Mark Twain's real name was Samuel Langhorne Clemens.
2199,Creative Writing,Hard,Most,"The book of poetry ""Howl"" by Allen Ginsberg led to an obscenity trial that overturned a ban on the book."
2200,Creative Writing,Hard,Most,"The first edition cover of F. Scott Fitzgerald's novel ""The Great Gatsby"" featured a night scene illustration."
2201,Creative Writing,Hard,Most,"The dystopian novel ""Brave New World"" by Aldous Huxley takes place in the year 2540."
2202,Creative Writing,Hard,Most,"The play ""Romeo and Juliet"" by William Shakespeare takes place in Verona, Italy."
2203,Creative Writing,Hard,Most,"John Steinbeck's novel ""The Grapes of Wrath"" is about a family traveling from Oklahoma to California."
2204,Creative Writing,Hard,Most,"James Joyce's novel ""Ulysses"" takes place in Dublin, Ireland over the course of a single day."
2205,Creative Writing,Hard,Most,The novelist Jane Austen never married.
2206,Creative Writing,Medium,Fairly,"E.B. White, author of Charlotte's Web, was also a longtime contributor to The New Yorker magazine."
2207,Creative Writing,Medium,Fairly,The novel Don Quixote by Miguel de Cervantes is considered the first modern novel.
2208,Creative Writing,Medium,Fairly,"The term ""stream of consciousness"" was coined by American psychologist William James to describe a narrative technique."
2209,Creative Writing,Medium,Fairly,Ernest Hemingway famously wrote standing up at a lectern.
2210,Creative Writing,Medium,Fairly,Jack Kerouac wrote his novel On the Road in three weeks on a continuous scroll of paper.
2211,Creative Writing,Medium,Fairly,Vladimir Nabokov's novel Lolita was originally written in Russian before being translated to English.
2212,Creative Writing,Medium,Fairly,The novel One Hundred Years of Solitude by Gabriel Garcia Marquez popularized the genre of magic realism.
2213,Creative Writing,Medium,Fairly,George Orwell's classic novel 1984 was originally titled The Last Man in Europe.
2214,Creative Writing,Medium,Fairly,Sylvia Plath was married to the British poet Ted Hughes.
2215,Creative Writing,Medium,Fairly,J.K. Rowling wrote the first Harry Potter book in Edinburgh coffee shops.
2216,Creative Writing,Medium,Fairly,William Shakespeare's play Macbeth is based on a real historical figure who was king of Scotland.
2217,Creative Writing,Medium,Fairly,Jane Austen's novels like Pride and Prejudice often feature romantic relationships as a central theme.
2218,Creative Writing,Medium,Fairly,The novel Moby Dick by Herman Melville is narrated in the first-person point of view of the character Ishmael.
2219,Creative Writing,Medium,Fairly,Mark Twain's classic novel The Adventures of Huckleberry Finn is written in vernacular English to represent the dialects of the characters.
2220,Creative Writing,Medium,Fairly,Poet Edgar Allan Poe pioneered the modern detective fiction genre with his short story The Murders in the Rue Morgue.
2221,Creative Writing,Medium,Fairly,Aldous Huxley's dystopian novel Brave New World imagines a future society controlled by genetic engineering and conditioning.
2222,Creative Writing,Medium,Fairly,The novel The Kite Runner by Khaled Hosseini is set in Afghanistan during periods of political turmoil.
2223,Creative Writing,Medium,Fairly,The plays of ancient Greek tragedian Sophocles like Oedipus Rex often feature tragic heroes.
2224,Creative Writing,Medium,Fairly,George R. R. Martin originally envisioned his A Song of Ice and Fire novels as a fantasy trilogy.
2225,Creative Writing,Easy,Least,"Creative writing includes fiction, poetry, drama, and creative nonfiction."
2226,Creative Writing,Easy,Least,Most creative writing is meant to entertain rather than inform.
2227,Creative Writing,Easy,Least,"Character, setting, and plot are key elements of creative fiction."
2228,Creative Writing,Easy,Least,"Poetry often uses literary devices like rhyme, rhythm, and metaphor."
2229,Creative Writing,Easy,Least,Playwrights write dialogue and stage directions for plays and screenplays.
2230,Creative Writing,Easy,Least,Memoirs and personal essays are examples of creative nonfiction.
2231,Creative Writing,Easy,Least,Fanfiction involves using existing fictional characters and settings.
2232,Creative Writing,Easy,Least,Most creative writers seek to publish their work professionally.
2233,Creative Writing,Easy,Least,"Creative writing requires imagination, observation, and discipline."
2234,Creative Writing,Easy,Least,Workshopping with others is a common way to get feedback on creative writing.
2235,Creative Writing,Easy,Least,Creative writing is offered as a major at many colleges and universities.
2236,Creative Writing,Easy,Least,Writers typically follow a standard format like APA or MLA when creative writing.
2237,Creative Writing,Easy,Least,Many famous authors like Stephen King and J.K. Rowling were instantly successful.
2238,Creative Writing,Easy,Least,Most full-time creative writers can earn a good living from their work.
2239,Creative Writing,Easy,Least,Creative writing requires no planning or organization before starting.
2240,Creative Writing,Easy,Least,Writers mainly improve through participating in workshops and classes.
2241,Creative Writing,Easy,Least,All creative writing must be completely original and not borrow from other works.
2242,Creative Writing,Easy,Least,The most important part of creative writing is the overall theme or message for readers.
2243,Creative Writing,Easy,Least,Novelists take years to research and outline their book ideas before writing them.
2244,Creative Writing,Easy,Least,Poetry and short stories are the most marketable and profitable types of creative writing.
2245,Cellular Biology,Hard,Most,The endoplasmic reticulum is an organelle that packages proteins and transports them within and outside the cell.
2246,Cellular Biology,Hard,Most,Centrioles play a crucial role in cell division by organizing microtubules during mitosis.
2247,Cellular Biology,Hard,Most,Smooth endoplasmic reticulum synthesizes lipids and steroid hormones but does not play a role in protein synthesis.
2248,Cellular Biology,Hard,Most,Telomerase is an enzyme that lengthens telomeres and allows cells to divide indefinitely.
2249,Cellular Biology,Hard,Most,Peroxisomes contain enzymes that break down fatty acids and amino acids and also degrade hydrogen peroxide.
2250,Cellular Biology,Hard,Most,The nucleolus is located inside the nucleus and is the site of ribosomal RNA synthesis and ribosome assembly.
2251,Cellular Biology,Hard,Most,Cytoskeleton components like microtubules and actin filaments provide structure and shape to cells and allow organelle movement.
2252,Cellular Biology,Hard,Most,Gap junctions allow for direct passage of ions and small molecules between adjacent animal cells.
2253,Cellular Biology,Hard,Most,"In plant cells, vacuoles store water, maintain turgor pressure, and contain pigments."
2254,Cellular Biology,Hard,Most,The cristae of mitochondria increase the surface area to allow greater ATP production through cellular respiration.
2255,Cellular Biology,Hard,Most,Ribosomes are made up of protein and ribosomal RNA and carry out protein synthesis in the cytoplasm.
2256,Cellular Biology,Hard,Most,"Lysosomes contain digestive enzymes that break down excess or worn-out organelles, food particles, and engulfed viruses or bacteria."
2257,Cellular Biology,Hard,Most,The plasma membrane is a phospholipid bilayer embedded with proteins that forms the boundary between the cell and its environment.
2258,Cellular Biology,Hard,Most,"In eukaryotic cells, the nucleus contains the genetic material and nucleolus where ribosome assembly occurs."
2259,Cellular Biology,Hard,Most,Endocytosis is the process by which cells absorb molecules or particles from outside the cell by engulfing them with their cell membrane.
2260,Cellular Biology,Hard,Most,"The Golgi apparatus modifies, sorts, and packages proteins and lipids for secretion outside the cell or use within the cell."
2261,Cellular Biology,Hard,Most,Microtubules grow outwards from the centrosome which acts as a microtubule organizing center in animal cells.
2262,Cellular Biology,Hard,Most,Flagella and cilia are hair-like structures containing microtubules that allow single-celled organisms to move.
2263,Cellular Biology,Hard,Most,Cholesterol is an important component of animal cell membranes and helps maintain membrane fluidity and permeability.
2264,Cellular Biology,Medium,Fairly,"The endoplasmic reticulum is an interconnected network of tubules, vesicles and sacs within the cytoplasm of a cell."
2265,Cellular Biology,Medium,Fairly,Glycolysis takes place in the mitochondria.
2266,Cellular Biology,Medium,Fairly,Mitochondria contain their own small chromosomes with genes that encode some mitochondrial proteins.
2267,Cellular Biology,Medium,Fairly,The cell nucleus contains most of the cell's DNA but no proteins.
2268,Cellular Biology,Medium,Fairly,Prokaryotic cells have no membrane-bound organelles.
2269,Cellular Biology,Medium,Fairly,Chloroplasts are found in plant cells but not animal cells.
2270,Cellular Biology,Medium,Fairly,The cellular process of pinocytosis involves a cell engulfing liquid from its environment.
2271,Cellular Biology,Medium,Fairly,Centrioles play a role in cell division by organizing microtubules.
2272,Cellular Biology,Medium,Fairly,Telomeres are repetitive sequences found only at the ends of chromosomes.
2273,Cellular Biology,Medium,Fairly,Smooth endoplasmic reticulum synthesizes lipids and steroid hormones in animal cells.
2274,Cellular Biology,Medium,Fairly,Ribosomes are organelles that translate mRNA into proteins.
2275,Cellular Biology,Medium,Fairly,"The cell membrane is selectively permeable, allowing some substances to pass through while blocking others."
2276,Cellular Biology,Medium,Fairly,Cells undergo mitosis to make identical copies of themselves before dividing.
2277,Cellular Biology,Medium,Fairly,Cytoskeleton fibers like microtubules help the cell maintain its shape and enable cellular motion.
2278,Cellular Biology,Medium,Fairly,Lysosomes are membrane-bound organelles containing digestive enzymes.
2279,Cellular Biology,Medium,Fairly,The nucleolus is a structure within the nucleus where ribosomal RNA is synthesized.
2280,Cellular Biology,Medium,Fairly,Adhesion proteins on the cell surface allow cells to attach to each other and the extracellular matrix.
2281,Cellular Biology,Medium,Fairly,"Plants, algae and some bacteria perform photosynthesis to convert light energy into chemical energy."
2282,Cellular Biology,Medium,Fairly,Cells communicate with each other using signaling molecules like hormones and neurotransmitters.
2283,Cellular Biology,Medium,Fairly,Mutations in DNA can lead to cancer and other diseases by disrupting normal cell functions.
2284,Cellular Biology,Easy,Least,Cells are the basic units of structure and function in living organisms.
2285,Cellular Biology,Easy,Least,The cell nucleus contains DNA.
2286,Cellular Biology,Easy,Least,Plant cells have cell walls but animal cells do not.
2287,Cellular Biology,Easy,Least,The mitochondria is the powerhouse of the cell.
2288,Cellular Biology,Easy,Least,Prokaryotic cells have a nucleus.
2289,Cellular Biology,Easy,Least,Cells divide through a process called mitosis.
2290,Cellular Biology,Easy,Least,Chloroplasts capture energy from sunlight to make food in a process called photosynthesis.
2291,Cellular Biology,Easy,Least,The endoplasmic reticulum transports proteins in vesicles.
2292,Cellular Biology,Easy,Least,Lysosomes break down waste materials and cellular debris in the cell.
2293,Cellular Biology,Easy,Least,Ribosomes assemble amino acids into proteins.
2294,Cellular Biology,Easy,Least,The fluid mosaic model describes the structure of the cell membrane.
2295,Cellular Biology,Easy,Least,Diffusion requires energy to move molecules across a membrane.
2296,Cellular Biology,Easy,Least,Osmosis is the diffusion of water across a semipermeable membrane.
2297,Cellular Biology,Easy,Least,The cytoskeleton helps the cell maintain its shape and enables cellular movement.
2298,Cellular Biology,Easy,Least,Motor proteins carry cellular components along microtubules.
2299,Cellular Biology,Easy,Least,Telomeres are repetitive sequences that protect the ends of chromosomes.
2300,Cellular Biology,Easy,Least,Stem cells are undifferentiated cells that can become specialized cell types.
2301,Cellular Biology,Easy,Least,Cancer results from uncontrolled cell division and proliferation.
2302,Cellular Biology,Easy,Least,Apoptosis is the programmed cell death that removes damaged cells.
2303,Cellular Biology,Easy,Least,Cellular respiration converts nutrients into ATP to provide energy.
2304,Music Production,Hard,Most,"The first popular music recording to use artificial double tracking was The Beatles song ""I'm Only Sleeping"" in 1966."
2305,Music Production,Hard,Most,"The drum machine Linn LM-1, released in 1980, was one of the first drum machines to use digital samples of acoustic drums."
2306,Music Production,Hard,Most,The music production technique known as sidechain compression originates from sidechaining multiple vinyl turntables together in the 1970s.
2307,Music Production,Hard,Most,Early digital synthesizers like the Yamaha DX7 used frequency modulation (FM) synthesis to create complex sounds with minimal computer processing power.
2308,Music Production,Hard,Most,"The term ""brickwall limiting"" refers to a limiter with an infinite compression ratio, completely preventing the signal from exceeding the threshold."
2309,Music Production,Hard,Most,"In hip hop music, the term ""chopping"" refers to repeating a small sample multiple times to create a beat."
2310,Music Production,Hard,Most,"The first commercial magnetic tape recorder, the AEG Magnetophon K1, was developed in Germany in 1935."
2311,Music Production,Hard,Most,"Digital Audio Tape (DAT) recorders, introduced in 1987, used a rotating helical scan head like a video tape recorder."
2312,Music Production,Hard,Most,"Equalization, or EQ, allows boosting or attenuating different frequency ranges in an audio signal."
2313,Music Production,Hard,Most,"In a digital audio workstation like Pro Tools, audio tracks record digital audio while MIDI tracks record MIDI note information."
2314,Music Production,Hard,Most,"Condenser microphones generally produce a brighter, more detailed sound compared to dynamic microphones."
2315,Music Production,Hard,Most,"In mastering, peak normalization refers to increasing a signal's overall volume so its highest peak hits a target level."
2316,Music Production,Hard,Most,"To remove vocal tracks from a stereo mix, phase inversion or phase cancellation techniques can be used."
2317,Music Production,Hard,Most,Quantization in MIDI sequencing forces notes to conform strictly to a rhythmic grid or groove.
2318,Music Production,Hard,Most,Brickwall limiting uses lookahead technology to detect peaks before they happen and compress them.
2319,Music Production,Hard,Most,The Nyquist-Shannon sampling theorem states that the sampling frequency must be at least twice the highest signal frequency.
2320,Music Production,Hard,Most,"In sound synthesis, additive synthesis recreates timbres by adding many sine waves together."
2321,Music Production,Hard,Most,"Vibrato is a regular, slight variation in pitch used by singers and instrumentalists to add expression."
2322,Music Production,Medium,Fairly,"In audio mixing, adding compressors and limiters is a form of downward expansion."
2323,Music Production,Medium,Fairly,Pulse Code Modulation (PCM) was developed in 1937 by British scientist Alec Reeves.
2324,Music Production,Medium,Fairly,"The first popular digital audio workstation (DAW) was the Fairlight CMI, released in 1979."
2325,Music Production,Medium,Fairly,Aliasing refers to digital artifacts caused by an insufficient sampling rate.
2326,Music Production,Medium,Fairly,"In a synthesizer, a Voltage Controlled Oscillator (VCO) generates basic waveforms using control voltages."
2327,Music Production,Medium,Fairly,"The first commercial Moog synthesizer was the Minimoog Model D, released in 1970."
2328,Music Production,Medium,Fairly,"In a tape delay, sound is recorded and played back on a magnetic tape loop to create an echo."
2329,Music Production,Medium,Fairly,Peak and RMS are two types of audio level measurements used in production.
2330,Music Production,Medium,Fairly,A de-esser is a compressor optimized to reduce sibilant frequencies.
2331,Music Production,Medium,Fairly,The pan pot on a mixing console adjusts the stereo positioning of a track.
2332,Music Production,Medium,Fairly,"In a piano roll editor, notes are represented graphically on a timeline."
2333,Music Production,Medium,Fairly,The first commercial stereo vinyl record was released in 1958 by Audio Fidelity Records.
2334,Music Production,Medium,Fairly,"Pink noise has equal energy in each octave band, as opposed to white noise."
