,topic,difficulty,obscurity,extracted_queries
3017,Baking,Easy,Least,Cupcakes are small versions of regular cakes.
3018,Baking,Easy,Least,Pizza dough uses yeast to rise before baking.
3019,Baking,Easy,Least,Scones are sweet pastries often eaten for breakfast.
3020,Art history,Easy,Least,Ancient Greek and Roman art focused on realistically depicting the human form.
3021,Art history,Easy,Least,The Renaissance was a cultural movement that started in Italy in the 14th century.
3022,Art history,Easy,Least,Impressionism was an artistic movement in the late 19th century that focused on depicting light and movement.
3023,Art history,Easy,Least,Pablo Picasso was a pioneering Cubist painter in the early 20th century.
3024,Art history,Easy,Least,Frida Kahlo was a Mexican painter known for her vibrant self-portraits.
3025,Art history,Easy,Least,Jackson Pollock was an American painter associated with the Abstract Expressionist movement.
3026,Art history,Easy,Least,Andy Warhol was a Pop artist known for his prints and paintings of Campbell's soup cans.
3027,Art history,Easy,Least,Vincent Van Gogh was a Dutch Post-Impressionist painter known for works like Starry Night.
3028,Art history,Easy,Least,Henri Matisse was a French artist and leading figure of Fauvism.
3029,Art history,Easy,Least,Georgia O'Keeffe was an American Modernist painter recognized for her flower paintings.
3030,Startups,Easy,Least,Startups are newly established businesses.
3031,Startups,Easy,Least,All startups are technology companies.
3032,Startups,Easy,Least,Startups often seek to develop innovative new products.
3033,Startups,Easy,Least,Startups typically have high amounts of initial funding.
3034,Startups,Easy,Least,Startups aim to grow quickly and scale their business.
3035,Startups,Easy,Least,Most startups become very large companies.
3036,Startups,Easy,Least,Startups tend to have flat organizational structures.
3037,Startups,Easy,Least,Startups are always founded by young entrepreneurs.
3038,Startups,Easy,Least,Few startups succeed long-term.
3039,Startups,Easy,Least,Startups don't need a business plan.
3040,Astronomy,Easy,Least,The Sun is a star.
3041,Astronomy,Easy,Least,The Earth revolves around the Sun.
3042,Astronomy,Easy,Least,Jupiter is the largest planet in our solar system.
3043,Astronomy,Easy,Least,The Moon orbits around the Earth.
3044,Astronomy,Easy,Least,Venus is the planet closest to the Sun.
3045,Astronomy,Easy,Least,Saturn has rings around it.
3046,Astronomy,Easy,Least,There are 8 planets in our solar system.
3047,Astronomy,Easy,Least,The North Star is the brightest star in the night sky.
3048,Astronomy,Easy,Least,A comet has a long glowing tail.
3049,Astronomy,Easy,Least,An astronaut has walked on Mars.
3050,Gardening,Easy,Least,Growing vegetables requires at least 6 hours of direct sunlight per day.
3051,Gardening,Easy,Least,Radishes are root vegetables.
3052,Gardening,Easy,Least,Rose bushes should be watered every day.
3053,Gardening,Easy,Least,Compost is made from decayed organic material.
3054,Gardening,Easy,Least,Marigolds are annual flowers.
3055,Gardening,Easy,Least,Pine trees are deciduous.
3056,Gardening,Easy,Least,Succulents store water in their leaves.
3057,Gardening,Easy,Least,Container gardening allows you to grow plants anywhere.
3058,Gardening,Easy,Least,Tomatoes are best grown in acidic soil.
3059,Gardening,Easy,Least,Strawberries are fruits.
3060,Philosophy,Easy,Least,Socrates was an ancient Greek philosopher.
3061,Philosophy,Easy,Least,Aristotle was Plato's teacher.
3062,Philosophy,Easy,Least,"René Descartes said ""I think, therefore I am."
3063,Philosophy,Easy,Least,"Friedrich Nietzsche wrote a book called ""Beyond Good and Evil."
3064,Philosophy,Easy,Least,Jean-Paul Sartre was an existentialist philosopher.
3065,Philosophy,Easy,Least,Ayn Rand advocated the philosophy of objectivism.
3066,Philosophy,Easy,Least,"Thomas Hobbes wrote ""Leviathan."
3067,Philosophy,Easy,Least,John Locke proposed the concept of the social contract.
3068,Philosophy,Easy,Least,Confucius was an ancient Chinese philosopher.
3069,Philosophy,Easy,Least,Buddha founded Buddhism.
3070,Engineering,Easy,Least,The field of engineering applies knowledge of math and science to solve problems.
3071,Engineering,Easy,Least,Engineering only deals with designing and building physical structures.
3072,Engineering,Easy,Least,Mechanical engineering focuses on the design and function of machines.
3073,Engineering,Easy,Least,Chemical engineers study chemistry and perform scientific experiments.
3074,Engineering,Easy,Least,"Civil engineering involves designing and constructing infrastructure like roads, bridges, and buildings."
3075,Engineering,Easy,Least,"Electrical engineers work with electricity, electronics and electromagnetism."
3076,Engineering,Easy,Least,Environmental engineering aims to protect the environment and human health.
3077,Engineering,Easy,Least,Industrial engineering focuses on improving efficiency and productivity.
3078,Engineering,Easy,Least,Aerospace engineering deals with aircraft and spacecraft design.
3079,Engineering,Easy,Least,Engineering first emerged as a field during the Industrial Revolution.
3080,Dance,Easy,Least,Ballet dancing originated in Italy during the Renaissance.
3081,Dance,Easy,Least,Tap dancing involves clicking shoes and rhythmic tapping of the toes and heels.
3082,Dance,Easy,Least,The waltz is a lively folk dance in triple time.
3083,Dance,Easy,Least,The tango originated in Argentina and Uruguay.
3084,Dance,Easy,Least,"The cha-cha is a slow, romantic dance from Cuba."
3085,Dance,Easy,Least,"Hip hop dance includes elements of popping, locking, and breaking."
3086,Dance,Easy,Least,"Ballroom dancing competitions have categories like tango, waltz, and foxtrot."
3087,Dance,Easy,Least,Irish dancing is characterized by stiff arms and intricate footwork.
3088,Dance,Easy,Least,"Krumping is an upbeat, energetic street dance style."
3089,Dance,Easy,Least,Line dancing involves individual freestyle moves.
3090,Literature,Easy,Least,William Shakespeare wrote Romeo and Juliet.
3091,Literature,Easy,Least,Charles Dickens wrote Moby Dick.
3092,Literature,Easy,Least,Mark Twain wrote The Adventures of Huckleberry Finn.
3093,Literature,Easy,Least,Ernest Hemingway wrote The Great Gatsby.
3094,Literature,Easy,Least,Jane Austen wrote Pride and Prejudice.
3095,Literature,Easy,Least,J.K. Rowling wrote the Harry Potter series.
3096,Literature,Easy,Least,J.R.R. Tolkien wrote The Lord of the Rings trilogy.
3097,Literature,Easy,Least,F. Scott Fitzgerald wrote The Catcher in the Rye.
3098,Literature,Easy,Least,Maya Angelou wrote I Know Why the Caged Bird Sings.
3099,Literature,Easy,Least,Dr. Seuss wrote The Cat in the Hat.
3100,Geology,Easy,Least,The Earth's inner core is solid.
3101,Geology,Easy,Least,The Earth's mantle is made up of molten rock called magma.
3102,Geology,Easy,Least,The Earth's crust is the outermost layer of the planet.
3103,Geology,Easy,Least,Plate tectonics refers to the movement of the Earth's crustal plates.
3104,Geology,Easy,Least,Volcanoes form at the boundaries where tectonic plates meet.
3105,Geology,Easy,Least,Earthquakes are caused by the sudden release of energy in the Earth's crust.
3106,Geology,Easy,Least,Metamorphic rocks are formed by intense heat and pressure within the Earth.
3107,Geology,Easy,Least,Sedimentary rocks are formed by the accumulation of sediments over time.
3108,Geology,Easy,Least,Fossils are the preserved remains or imprints of ancient organisms.
3109,Geology,Easy,Least,Glaciers are large bodies of ice that move slowly under their own weight.
3110,Architecture,Easy,Least,Gothic architecture is characterized by pointed arches.
3111,Architecture,Easy,Least,Art deco architecture originated in the 1930s.
3112,Architecture,Easy,Least,Le Corbusier was an influential modernist architect.
3113,Architecture,Easy,Least,The pyramids are examples of ancient Egyptian architecture.
3114,Architecture,Easy,Least,Frank Lloyd Wright designed the Guggenheim museum in New York City.
3115,Architecture,Easy,Least,Architecture is considered one of the fine arts.
3116,Architecture,Easy,Least,The Pantheon in Rome has a concrete dome.
3117,Architecture,Easy,Least,Brutalist architecture features ornate decorative elements.
3118,Architecture,Easy,Least,Fallingswater by Frank Lloyd Wright is built over a waterfall.
3119,Architecture,Easy,Least,Antoni Gaudí designed the Sagrada Família church in Barcelona.
3120,Economics,Easy,Least,A key principle of economics is that resources are scarce.
3121,Economics,Easy,Least,Supply and demand are basic concepts in economics.
3122,Economics,Easy,Least,Economics is primarily the study of how goods and services are produced and consumed.
3123,Economics,Easy,Least,Microeconomics examines the behavior of individual consumers and firms.
3124,Economics,Easy,Least,"Macroeconomics looks at entire economies and economic indicators like GDP, unemployment, and inflation."
3125,Economics,Easy,Least,"In a free market economy, prices are determined by supply and demand with little government intervention."
3126,Economics,Easy,Least,Monopolies occur when a company has exclusive control over a good or service.
3127,Economics,Easy,Least,Oligopolies are markets dominated by a small number of large sellers.
3128,Economics,Easy,Least,"Factors of production are inputs used to produce goods and services, like land, labor, capital, and entrepreneurship."
3129,Economics,Easy,Least,Fiscal policy refers to government taxation and spending policies that influence economic conditions.
3130,Travel,Easy,Least,It takes less than 5 hours to fly from New York to Los Angeles.
3131,Travel,Easy,Least,"The Eiffel Tower is located in Rome, Italy."
3132,Travel,Easy,Least,Mount Everest is the tallest mountain in the world.
3133,Travel,Easy,Least,The Sahara Desert is the largest hot desert in the world.
3134,Travel,Easy,Least,The Great Wall of China is visible from space.
3135,Travel,Easy,Least,Buenos Aires is the capital of Brazil.
3136,Travel,Easy,Least,"The Leaning Tower of Pisa is located in Venice, Italy."
3137,Travel,Easy,Least,The Great Barrier Reef is located off the coast of Australia.
3138,Travel,Easy,Least,The North Pole and South Pole are both very cold places.
3139,Travel,Easy,Least,The Amazon River is located in Africa.
3140,Biology,Easy,Least,Cells are the basic units of structure and function in living things.
3141,Biology,Easy,Least,DNA carries the genetic information that determines traits in an organism.
3142,Biology,Easy,Least,The process by which plants convert sunlight into energy is called photosynthesis.
3143,Biology,Easy,Least,The human body has over 200 bones.
3144,Biology,Easy,Least,The smallest unit of life is the atom.
3145,Biology,Easy,Least,Animals that eat only meat are called herbivores.
3146,Biology,Easy,Least,Bacteria and fungi are examples of microorganisms.
3147,Biology,Easy,Least,The heart pumps blood through the circulatory system.
3148,Biology,Easy,Least,The brain is located in the head.
3149,Biology,Easy,Least,Skin is an organ.
3150,Fashion,Easy,Least,Bell bottom pants were popular in the 1970s.
3151,Fashion,Easy,Least,Most fashion runway models are very tall.
3152,Fashion,Easy,Least,Jeans were originally designed for cowboys.
3153,Fashion,Easy,Least,High heels were originally worn by men.
3154,Fashion,Easy,Least,The miniskirt became fashionable in the 1960s.
3155,Fashion,Easy,Least,Fur coats are made from animal fur.
3156,Fashion,Easy,Least,Polyester is a natural fabric.
3157,Fashion,Easy,Least,A ball gown is a formal evening dress.
3158,Fashion,Easy,Least,Socks are usually made of cotton.
3159,Fashion,Easy,Least,Most shirts have buttons down the back.
3160,Archaeology,Easy,Least,Archaeology is the study of past human cultures through material remains.
3161,Archaeology,Easy,Least,The archaeological record only includes things made of stone.
3162,Archaeology,Easy,Least,Archaeologists study artifacts to learn about past societies and cultures.
3163,Archaeology,Easy,Least,Excavation is the main method archaeologists use.
3164,Archaeology,Easy,Least,Carbon dating can determine the age of organic remains.
3165,Archaeology,Easy,Least,Archaeologists work at construction sites to identify and preserve historic artifacts.
3166,Archaeology,Easy,Least,All archaeologists focus on ancient civilizations.
3167,Archaeology,Easy,Least,Underwater archaeology examines shipwrecks and submerged sites.
3168,Archaeology,Easy,Least,Archaeology relies solely on material evidence with no written records.
3169,Archaeology,Easy,Least,Artifacts are useless without context from the surrounding archaeological site.
3170,Culinary arts,Easy,Least,Pasta is a traditional Italian food.
3171,Culinary arts,Easy,Least,"Hamburgers originally came from Hamburg, Germany."
3172,Culinary arts,Easy,Least,Sushi originates from Japan.
3173,Culinary arts,Easy,Least,Paella is a rice dish from Spain.
3174,Culinary arts,Easy,Least,Tacos are a traditional Mexican dish.
3175,Culinary arts,Easy,Least,Curry dishes come from India.
3176,Culinary arts,Easy,Least,Steak and potatoes is a classic American dinner.
3177,Culinary arts,Easy,Least,Pho is a Vietnamese noodle soup.
3178,Culinary arts,Easy,Least,Hummus is a dip or spread made from chickpeas.
3179,Culinary arts,Easy,Least,Peking duck is a dish from China.
3180,Mathematics,Easy,Least,Two plus two equals four.
3181,Mathematics,Easy,Least,There are 360 degrees in a circle.
3182,Mathematics,Easy,Least,A triangle has three sides.
3183,Mathematics,Easy,Least,The square root of 64 is 8.
3184,Mathematics,Easy,Least,Parallel lines never intersect.
3185,Mathematics,Easy,Least,Zero is an even number.
3186,Mathematics,Easy,Least,Pi is equal to 3.14.
3187,Mathematics,Easy,Least,A decade has 9 years.
3188,Mathematics,Easy,Least,Equilateral triangles have three equal sides.
3189,Mathematics,Easy,Least,"The sum of a number's factors, including 1 but not itself, is called its aliquot sum."
3190,Photography,Easy,Least,A camera uses a lens to focus light onto photographic film or a digital sensor.
3191,Photography,Easy,Least,The first permanent photograph was produced by Joseph Nicéphore Niépce in 1826.
3192,Photography,Easy,Least,Shutter speed refers to how long the camera's shutter remains open as the picture is taken.
3193,Photography,Easy,Least,ISO measures the camera's sensitivity to light.
3194,Photography,Easy,Least,A higher f-stop number means more light enters the camera.
3195,Photography,Easy,Least,Depth of field refers to the distance between the nearest and farthest objects that are in focus.
3196,Photography,Easy,Least,A prime lens has a fixed focal length.
3197,Photography,Easy,Least,DSLR stands for Digital Single Lens Reflex.
3198,Photography,Easy,Least,HDR stands for High Dynamic Range and can help capture details in both very dark and very bright areas of a photo.
3199,Photography,Easy,Least,A gray card can be used to set custom white balance on a camera.
3200,Neuroscience,Easy,Least,The brain is the control center of the nervous system.
3201,Neuroscience,Easy,Least,There are over 100 billion neurons in the adult human brain.
3202,Neuroscience,Easy,Least,The cerebellum controls balance and coordination.
3203,Neuroscience,Easy,Least,The medulla oblongata controls breathing and heart rate.
3204,Neuroscience,Easy,Least,The limbic system processes emotions and memory.
3205,Neuroscience,Easy,Least,The frontal lobe controls personality and reasoning.
3206,Neuroscience,Easy,Least,The occipital lobe processes visual information.
3207,Neuroscience,Easy,Least,The temporal lobe processes auditory information and language.
3208,Neuroscience,Easy,Least,Dopamine and serotonin are neurotransmitters in the brain.
3209,Neuroscience,Easy,Least,Alzheimer's disease affects memory and thinking skills.
3210,Meteorology,Easy,Least,Clouds are made of water droplets or ice crystals.
3211,Meteorology,Easy,Least,"The water cycle describes how water evaporates, condenses, and precipitates."
3212,Meteorology,Easy,Least,Air pressure decreases as altitude increases.
3213,Meteorology,Easy,Least,Hurricanes form over tropical oceans.
3214,Meteorology,Easy,Least,Thunderstorms produce lightning and thunder.
3215,Meteorology,Easy,Least,Fronts are boundaries between air masses of different temperatures.
3216,Meteorology,Easy,Least,Winds blow from areas of high pressure to low pressure.
3217,Meteorology,Easy,Least,Fog forms when warm air passes over a cold surface.
3218,Meteorology,Easy,Least,Tornadoes form during severe thunderstorms.
3219,Meteorology,Easy,Least,Weather refers to short-term atmospheric conditions while climate describes long-term patterns.
3220,Veterinary medicine,Easy,Least,Dogs are omnivores and can eat both meat and plants.
3221,Veterinary medicine,Easy,Least,Cats are obligate carnivores and must eat meat to survive.
3222,Veterinary medicine,Easy,Least,Horses are herbivores and only eat plant material.
3223,Veterinary medicine,Easy,Least,The normal body temperature for a dog is 101-102.5 degrees Fahrenheit.
3224,Veterinary medicine,Easy,Least,"Rabies is a fatal viral disease that can infect mammals including dogs, cats, raccoons, and bats."
3225,Veterinary medicine,Easy,Least,Heartworm disease in dogs is transmitted by mosquitoes.
3226,Veterinary medicine,Easy,Least,Fleas can transmit tapeworms to dogs and cats when ingested during grooming.
3227,Veterinary medicine,Easy,Least,Dogs have a longer small intestine and shorter large intestine compared to humans.
3228,Veterinary medicine,Easy,Least,Cattle are ruminants with a 4-chambered stomach.
3229,Veterinary medicine,Easy,Least,Reptiles are cold-blooded animals that rely on external heat sources to regulate their body temperature.
3230,Computer science,Easy,Least,"The first modern computer was the ENIAC, built in 1946."
3231,Computer science,Easy,Least,JavaScript is an object-oriented programming language.
3232,Computer science,Easy,Least,The C programming language was created by Dennis Ritchie.
3233,Computer science,Easy,Least,HTML stands for Hypertext Markup Language.
3234,Computer science,Easy,Least,The Boolean data type can only have values of true or false.
3235,Computer science,Easy,Least,Python is an interpreted programming language.
3236,Computer science,Easy,Least,The CPU executes instructions stored in RAM.
3237,Computer science,Easy,Least,HTTPS uses SSL/TLS encryption to secure internet connections.
3238,Computer science,Easy,Least,"Pixel is short for ""picture element""."
3239,Computer science,Easy,Least,Compilers convert human-readable code into machine code.
3240,Physics,Easy,Least,Light travels faster than sound.
3241,Physics,Easy,Least,Objects fall towards the earth because of gravity.
3242,Physics,Easy,Least,Mass and weight are the same thing.
3243,Physics,Easy,Least,Atoms are smaller than molecules.
3244,Physics,Easy,Least,The normal boiling point of water is 100 degrees Celsius.
3245,Physics,Easy,Least,Friction causes objects to slow down.
3246,Physics,Easy,Least,An object's momentum is its mass multiplied by its velocity.
3247,Physics,Easy,Least,Nuclear fusion powers the sun.
3248,Physics,Easy,Least,Quantum mechanics describes subatomic particles.
3249,Physics,Easy,Least,Newton's first law states that an object in motion stays in motion.
3250,Poetry,Easy,Least,Poetry is a form of written or spoken text that is arranged in lines that often rhyme.
3251,Poetry,Easy,Least,All poems must rhyme.
3252,Poetry,Easy,Least,"Poems are typically short, while novels and stories are longer forms of writing."
3253,Poetry,Easy,Least,"Common types of poems include sonnets, odes, elegies, and haikus."
3254,Poetry,Easy,Least,"The main elements of poetry are rhyme, rhythm, imagery, and symbolism."
3255,Poetry,Easy,Least,Poems only express emotions.
3256,Poetry,Easy,Least,Poets carefully choose words for their meaning as well as sound.
3257,Poetry,Easy,Least,"Shakespeare only wrote plays, not poetry."
3258,Poetry,Easy,Least,Poetry originated in the 19th century.
3259,Poetry,Easy,Least,Many famous song lyrics are considered to be poetry.
3260,Sculpture,Easy,Least,Ancient Greek and Roman sculptures were often made of marble.
3261,Sculpture,Easy,Least,Rodin's The Thinker sculpture depicts a seated nude male figure in a contemplative pose.
3262,Sculpture,Easy,Least,Michelangelo's David sculpture depicts the biblical figure David ready to fight Goliath.
3263,Sculpture,Easy,Least,Sculptures made of bronze often develop a green patina over time.
3264,Sculpture,Easy,Least,Auguste Rodin was a French sculptor known for works like The Kiss.
3265,Sculpture,Easy,Least,Henry Moore was a modern British sculptor known for semi-abstract reclining figures.
3266,Sculpture,Easy,Least,Traditional sculptures were always made of stone or metal.
3267,Sculpture,Easy,Least,Louise Nevelson created abstract collage sculptures made from found objects.
3268,Sculpture,Easy,Least,"Constantin Brâncuși was a Romanian sculptor known for simplified, geometric forms."
3269,Sculpture,Easy,Least,Sculptures are three-dimensional works of art.
3270,Theater,Easy,Least,The ancient Greeks were the first to build theaters and perform plays.
3271,Theater,Easy,Least,William Shakespeare wrote Romeo and Juliet.
3272,Theater,Easy,Least,Broadway refers to theater productions in New York City.
3273,Theater,Easy,Least,The Phantom of the Opera is a tragedy.
3274,Theater,Easy,Least,Cats is the longest running Broadway musical.
3275,Theater,Easy,Least,Hamlet is a comedy.
3276,Theater,Easy,Least,George Bernard Shaw wrote Death of a Salesman.
3277,Theater,Easy,Least,Annie Get Your Gun is about sharpshooting.
3278,Theater,Easy,Least,August Wilson wrote primarily for the screen.
3279,Theater,Easy,Least,Lin-Manuel Miranda wrote the musical Hamilton.
3280,Chemistry,Easy,Least,Elements are substances that cannot be chemically broken down into simpler substances.
3281,Chemistry,Easy,Least,The periodic table organizes elements according to increasing atomic number.
3282,Chemistry,Easy,Least,Covalent bonds involve the sharing of electron pairs between atoms.
3283,Chemistry,Easy,Least,Acids release hydrogen ions (H+) in aqueous solutions.
3284,Chemistry,Easy,Least,The pH scale measures how acidic or basic a solution is.
3285,Chemistry,Easy,Least,Combustion reactions involve a fuel reacting with oxygen to release energy as heat and light.
3286,Chemistry,Easy,Least,"In an exothermic reaction, energy is absorbed from the surroundings."
3287,Chemistry,Easy,Least,The atomic number of an element is the number of protons in its nucleus.
3288,Chemistry,Easy,Least,Isotopes of an element have the same number of protons but different numbers of neutrons.
3289,Chemistry,Easy,Least,Molecules are electrically neutral groups of atoms held together by chemical bonds.
3290,Religion,Easy,Least,Jesus is considered a prophet in Islam.
3291,Religion,Easy,Least,The holy book of Christianity is the Bible.
3292,Religion,Easy,Least,Hinduism originated in India.
3293,Religion,Easy,Least,Buddhism was founded by Confucius.
3294,Religion,Easy,Least,Judaism is an Abrahamic religion.
3295,Religion,Easy,Least,Taoism started in China.
3296,Religion,Easy,Least,The Pope is the head of the Catholic Church.
3297,Religion,Easy,Least,Sikhism is a polytheistic religion.
3298,Religion,Easy,Least,Ramadan is a holy month in Islam.
3299,Religion,Easy,Least,Diwali is a Hindu festival of lights.
3300,Politics,Easy,Least,The current president of the United States is Joe Biden.
3301,Politics,Easy,Least,There are 50 states in the United States of America.
3302,Politics,Easy,Least,The capital of the United States is Washington D.C.
3303,Politics,Easy,Least,The United Kingdom is a constitutional monarchy.
3304,Politics,Easy,Least,Angela Merkel is the current Chancellor of Germany.
3305,Politics,Easy,Least,Vladimir Putin is the current president of Russia.
3306,Politics,Easy,Least,India is the world's largest democracy.
3307,Politics,Easy,Least,China is ruled by the Communist Party.
3308,Politics,Easy,Least,Justin Trudeau is the Prime Minister of Canada.
3309,Politics,Easy,Least,Brazil is located in South America.
3310,Agriculture,Easy,Least,Corn is considered a grain crop.
3311,Agriculture,Easy,Least,Rice is grown in flooded fields.
3312,Agriculture,Easy,Least,Wheat is used to make bread.
3313,Agriculture,Easy,Least,Soybeans are used to make vegetable oil.
3314,Agriculture,Easy,Least,Cotton is used to make clothing.
3315,Agriculture,Easy,Least,Cows produce milk.
3316,Agriculture,Easy,Least,Chickens lay eggs.
3317,Agriculture,Easy,Least,Goats produce milk.
3318,Agriculture,Easy,Least,Oranges grow on trees.
3319,Agriculture,Easy,Least,Strawberries are a nut.
3320,Psychology,Easy,Least,Psychology is the study of the mind and behavior.
3321,Psychology,Easy,Least,Classical conditioning involves associating a neutral stimulus with an unconditioned stimulus.
3322,Psychology,Easy,Least,Cognitive therapy focuses on changing a person's core beliefs and schemas.
3323,Psychology,Easy,Least,The id is the part of the personality that contains our primitive impulses and drives according to Freud.
3324,Psychology,Easy,Least,Operant conditioning involves using reinforcement or punishment to modify behavior.
3325,Psychology,Easy,Least,The hippocampus is involved in forming new memories.
3326,Psychology,Easy,Least,The sympathetic nervous system activates the fight-or-flight response.
3327,Psychology,Easy,Least,Psychologists use double-blind experimental designs to control for experimenter bias.
3328,Psychology,Easy,Least,The Stanford-Binet test is an example of an intelligence test.
3329,Psychology,Easy,Least,Psychology is considered a social science.
