,topic,difficulty,obscurity,extracted_queries
0,Quantum Physics,Hard,Most,"In quantum physics, the Heisenberg Uncertainty Principle states that the more precisely the position of a particle is determined, the less precisely its momentum can be known."
1,Quantum Physics,Hard,Most,"The wave-particle duality of light is explained by quantum physics, which says light can behave both as a particle and as a wave."
2,Quantum Physics,Hard,Most,"In the double slit experiment, individual photons interfere with themselves as waves when passing through two parallel slits, producing an interference pattern on a screen."
3,Quantum Physics,Hard,Most,"Quantum entanglement is a phenomenon in which two or more quantum particles remain connected so that actions performed on one affect the others, even when separated by large distances."
4,Quantum Physics,Hard,Most,"The electron spin is quantized, meaning the component of angular momentum measured along one direction can only take on integer multiples of Planck's constant divided by 2π."
5,Quantum Physics,Hard,Most,"In quantum tunneling, a particle can pass through a potential barrier despite having insufficient energy to classically surmount the barrier."
6,Quantum Physics,Hard,Most,The photoelectric effect provides direct evidence for the existence of the photon and particles of light with discrete energy.
7,Quantum Physics,Hard,Most,"In the two-slit electron interference experiment, individual electrons build up an interference pattern over time, demonstrating wave-particle duality."
8,Quantum Physics,Hard,Most,Quantum teleportation can transmit the quantum state and properties of a particle to another distant particle without moving the original particle.
9,Quantum Physics,Hard,Most,The Pauli exclusion principle states that two identical fermions cannot occupy the same quantum state simultaneously.
10,Quantum Physics,Hard,Most,Quantum superposition refers to the phenomenon where a quantum system can exist in multiple states at once until it is measured.
11,Quantum Physics,Hard,Most,"In quantum mechanics, observable physical properties are represented by linear Hermitian operators that act on the quantum state."
12,Quantum Physics,Hard,Most,"The quantization of angular momentum is a consequence of wave-particle duality, resulting in discrete energy levels."
13,Quantum Physics,Hard,Most,Quantum decoherence describes how interference and superposition are lost when a quantum system interacts with its environment.
14,Quantum Physics,Hard,Most,Quantum entanglement leads to experimentally observable non-local correlations between measurement outcomes.
15,Quantum Physics,Hard,Most,The quantum spin Hall effect is a topological state of matter with conducting edge states protected against scattering.
16,Quantum Physics,Hard,Most,Quantum annealing uses quantum fluctuations to tunnel through barriers in an optimization problem to find the global minimum.
17,Quantum Physics,Hard,Most,Quantum computers utilize superposition and entanglement to potentially solve certain problems faster than classical computers.
18,Quantum Physics,Medium,Fairly,A photon's spin angular momentum can only be +1 or -1.
19,Quantum Physics,Medium,Fairly,The Copenhagen interpretation asserts that a particle has no definite properties prior to measurement.
20,Quantum Physics,Medium,Fairly,The collapse of a quantum wavefunction occurs instantaneously across all space.
21,Quantum Physics,Medium,Fairly,Bell's theorem proves that no local hidden variable theory can reproduce all the predictions of quantum mechanics.
22,Quantum Physics,Medium,Fairly,Quantum entanglement allows faster-than-light communication between observers.
23,Quantum Physics,Medium,Fairly,Quantum tunneling refers to a particle crossing a potential barrier despite having insufficient energy to classically surmount it.
24,Quantum Physics,Medium,Fairly,The de Broglie wavelength of a particle is inversely proportional to its momentum.
25,Quantum Physics,Medium,Fairly,"According to quantum field theory, particles are excitations of underlying quantum fields that permeate space."
26,Quantum Physics,Medium,Fairly,"In the double slit experiment, interference fringes are still observed even when particles are sent through one at a time."
27,Quantum Physics,Medium,Fairly,The Einstein-Podolsky-Rosen paradox proves that quantum mechanics is an incomplete theory.
28,Quantum Physics,Medium,Fairly,Erwin Schrödinger's famous thought experiment involved a cat in a box that is simultaneously alive and dead.
29,Quantum Physics,Medium,Fairly,The photoelectric effect provided early evidence for the existence of photons.
30,Quantum Physics,Medium,Fairly,Quantum entanglement cannot be used to transmit information faster than the speed of light.
31,Quantum Physics,Medium,Fairly,"Werner Heisenberg's uncertainty principle states that the more precisely one property of a particle is measured, the less precisely other properties can be known."
32,Quantum Physics,Medium,Fairly,"In quantum mechanics, particles do not follow definite paths."
33,Quantum Physics,Medium,Fairly,The Pauli exclusion principle explains why electrons fill atomic orbitals in the order they do.
34,Quantum Physics,Medium,Fairly,Quantum tunneling plays an important role in nuclear fusion within stars.
35,Quantum Physics,Medium,Fairly,Quantum teleportation can transmit the exact state of a quantum system to another location.
36,Quantum Physics,Medium,Fairly,"The spin of an electron is quantized, meaning it can only take on certain discrete values."
37,Quantum Physics,Medium,Fairly,Quantum computers utilize the phenomena of superposition and entanglement to outperform classical computers.
38,Quantum Physics,Easy,Least,Electrons behave like particles and waves.
39,Quantum Physics,Easy,Least,The photoelectric effect provided evidence for the particle nature of light.
40,Quantum Physics,Easy,Least,Quantum tunneling allows particles to pass through potential energy barriers.
41,Quantum Physics,Easy,Least,The Schrödinger equation describes the wavefunction of a quantum system.
42,Quantum Physics,Easy,Least,Quantum entanglement leads to nonlocal correlations between particles.
43,Quantum Physics,Easy,Least,The Pauli exclusion principle states that no two identical fermions can occupy the same quantum state.
44,Quantum Physics,Easy,Least,The double slit experiment demonstrates the wave nature of matter.
45,Quantum Physics,Easy,Least,Quantum superposition refers to particles existing in multiple states at once.
46,Quantum Physics,Easy,Least,"Heisenberg's uncertainty principle states that the more precisely one property is measured, the less precisely the other can be controlled."
47,Quantum Physics,Easy,Least,Quantum mechanics is deterministic.
48,Quantum Physics,Easy,Least,Wave-particle duality is a central concept in quantum mechanics.
49,Quantum Physics,Easy,Least,The spin of an electron is quantized.
50,Quantum Physics,Easy,Least,Quantum physics completely rejects the principles of classical mechanics.
51,Quantum Physics,Easy,Least,Quantum entanglement can be used for quantum teleportation.
52,Quantum Physics,Easy,Least,The EPR paradox concerned the completeness of quantum mechanics.
53,Quantum Physics,Easy,Least,Quantum computers utilize the principles of superposition and entanglement.
54,Quantum Physics,Easy,Least,Bell's theorem proves that local hidden variable theories cannot reproduce all predictions of quantum mechanics.
55,Quantum Physics,Easy,Least,Quantum tunneling plays an important role in nuclear fusion within stars.
56,Quantum Physics,Easy,Least,The quantum Zeno effect causes an unstable particle to remain in its initial state under constant observation.
57,Quantum Physics,Easy,Least,Quantum decoherence explains how quantum systems interact with the environment.
58,Marine Biology,Hard,Most,The lifespan of the Antarctic toothfish can exceed 50 years.
59,Marine Biology,Hard,Most,"The spotted handfish is a species of fish that uses its pectoral fins to ""walk"" along the seafloor."
60,Marine Biology,Hard,Most,"Giant tubeworms that live near hydrothermal vents do not have a mouth, stomach or gut."
61,Marine Biology,Hard,Most,The fangtooth fish has the largest teeth relative to body size of any known fish.
62,Marine Biology,Hard,Most,Hagfish are the only known marine animals with a cranium but no vertebral column.
63,Marine Biology,Hard,Most,The pearlfish is known for taking shelter inside sea cucumbers for protection.
64,Marine Biology,Hard,Most,The flapjack octopus was first discovered in the deep seas near the Mariana Trench in 1998.
65,Marine Biology,Hard,Most,Giant isopods are a type of crustacean that can grow up to 14 inches long.
66,Marine Biology,Hard,Most,The immortal jellyfish is able to reverse its lifecycle to a sexually immature stage after reaching maturity.
67,Marine Biology,Hard,Most,The mantis shrimp has the most complex visual system ever discovered in the animal kingdom.
68,Marine Biology,Hard,Most,Kelp forests only grow in cold water environments.
69,Marine Biology,Hard,Most,The blue whale is the largest animal on Earth.
70,Marine Biology,Hard,Most,Coral reefs are made up of living animals called polyps.
71,Marine Biology,Hard,Most,The mariana trench is the deepest point in the ocean.
72,Marine Biology,Hard,Most,Manta rays are harmless to humans.
73,Marine Biology,Hard,Most,Seahorses are the only species where the male carries and gives birth to the offspring.
74,Marine Biology,Hard,Most,Sharks have no bones in their bodies.
75,Marine Biology,Hard,Most,Octopuses have three hearts.
76,Marine Biology,Hard,Most,Dolphins use echolocation to navigate and hunt.
77,Marine Biology,Hard,Most,Sea stars can regenerate lost limbs.
78,Marine Biology,Medium,Fairly,The mahi-mahi fish is able to change colors when removed from the water.
79,Marine Biology,Medium,Fairly,The world's largest known sponge measures 12 feet wide and 7 feet tall.
80,Marine Biology,Medium,Fairly,The blanket octopus is immune to the venom of the Portuguese man o' war jellyfish.
81,Marine Biology,Medium,Fairly,The deepest point in the ocean is called the Mariana Trench and measures nearly 7 miles deep.
82,Marine Biology,Medium,Fairly,Seahorses are the only fish that swim upright.
83,Marine Biology,Medium,Fairly,Coral reefs occupy less than 1% of the ocean floor but are home to 25% of all marine species.
84,Marine Biology,Medium,Fairly,The longest animal in the world is the lion's mane jellyfish which can have tentacles over 120 feet long.
85,Marine Biology,Medium,Fairly,"The blue whale is the loudest animal on Earth, producing calls and clicks that can be heard for hundreds of miles."
86,Marine Biology,Medium,Fairly,"Less than 5% of the ocean floor has been mapped, explored and studied by scientists."
87,Marine Biology,Medium,Fairly,Giant clams can weigh over 500 pounds and live over 100 years.
88,Marine Biology,Medium,Fairly,"Krill are one of the most abundant organisms on Earth, with estimates of over 500 trillion individuals."
89,Marine Biology,Medium,Fairly,The tentacles of the lion's mane jellyfish can reach over 120 feet long.
90,Marine Biology,Medium,Fairly,"Sea otters have the thickest fur of any mammal, with up to 1 million hairs per square inch."
91,Marine Biology,Medium,Fairly,The Mariana Trench in the Pacific Ocean is the deepest point on Earth at nearly 7 miles deep.
92,Marine Biology,Medium,Fairly,Flounders are a type of flatfish that are born with one eye on each side but end up with both eyes on one side.
93,Marine Biology,Medium,Fairly,Seahorses are monogamous and mate for life.
94,Marine Biology,Medium,Fairly,"Whale sharks are the largest fish species in the world, growing up to 60 feet long."
95,Marine Biology,Medium,Fairly,Great white sharks can detect one drop of blood in 25 gallons of water.
96,Marine Biology,Medium,Fairly,Coral polyps secrete a hard calcium carbonate exoskeleton that forms coral reefs.
97,Marine Biology,Medium,Fairly,"The mantis shrimp has one of the fastest punches in the animal kingdom, striking prey with the force of a .22 caliber bullet."
98,Marine Biology,Easy,Least,Coral reefs are formed from the calcium carbonate skeletons of coral polyps.
99,Marine Biology,Easy,Least,The ocean sunfish is the heaviest known bony fish in the world.
100,Marine Biology,Easy,Least,"Kelp are a type of brown algae that grow in shallow, nutrient-rich saltwater."
101,Marine Biology,Easy,Least,Whales are mammals that live their entire lives in the ocean.
102,Marine Biology,Easy,Least,Seahorses are a species of fish that swim upright and have a curled prehensile tail.
103,Marine Biology,Easy,Least,Giant squid can grow up to 43 feet in length.
104,Marine Biology,Easy,Least,Octopuses have eight arms and blue blood.
105,Marine Biology,Easy,Least,The green sea turtle is the largest of all the hard-shelled sea turtles.
106,Marine Biology,Easy,Least,Dolphins use echolocation to find prey and navigate.
107,Marine Biology,Easy,Least,Sharks have cartilage rather than bone in their skeletons.
108,Marine Biology,Easy,Least,The deepest point in the ocean is called the Challenger Deep.
109,Marine Biology,Easy,Least,Coral can only thrive in warm tropical waters.
110,Marine Biology,Easy,Least,Krill are an important food source for many ocean species like whales.
111,Marine Biology,Easy,Least,The largest animal ever known to exist is the blue whale.
112,Marine Biology,Easy,Least,"Shrimp, lobsters, and crabs are examples of crustaceans."
113,Marine Biology,Easy,Least,Bioluminescence is light produced by living organisms like fireflies and anglerfish.
114,Marine Biology,Easy,Least,Mollusks like clams and oysters produce pearls.
115,Marine Biology,Easy,Least,Photosynthesis by phytoplankton provides much of the Earth's oxygen.
116,Marine Biology,Easy,Least,El Nino affects ocean temperatures and marine life across the Pacific.
117,Marine Biology,Easy,Least,The tube-like structures of a sea sponge help filter food from water.
118,Renaissance Art,Hard,Most,Sandro Botticelli's The Birth of Venus was commissioned by the Medici family of Florence.
119,Renaissance Art,Hard,Most,"Leonardo da Vinci's Mona Lisa depicts Lisa Gherardini, the wife of Francesco del Giocondo."
120,Renaissance Art,Hard,Most,Michelangelo's David sculpture was originally intended to sit atop the cathedral in Florence.
121,Renaissance Art,Hard,Most,Jan van Eyck pioneered the use of oil paints in his work The Arnolfini Portrait.
122,Renaissance Art,Hard,Most,"Albrecht Dürer's engraving Knight, Death and the Devil was inspired by the horrors of the Black Death."
123,Renaissance Art,Hard,Most,Raphael's School of Athens was painted in the Apostolic Palace in the Vatican.
124,Renaissance Art,Hard,Most,Hieronymus Bosch's triptych The Garden of Earthly Delights contains hidden references to alchemy.
125,Renaissance Art,Hard,Most,Pieter Bruegel the Elder is renowned for his landscapes and peasant scenes like The Harvesters.
126,Renaissance Art,Hard,Most,El Greco's exaggerated and elongated figures were influenced by his Byzantine style.
127,Renaissance Art,Hard,Most,Artemisia Gentileschi was the first woman to become a member of the Accademia di Arte del Disegno in Florence.
128,Renaissance Art,Hard,Most,Donatello's sculpture of David was the first freestanding nude male sculpture made since ancient times.
129,Renaissance Art,Hard,Most,Giotto's frescoes in the Scrovegni Chapel depict scenes from the life of Jesus Christ.
130,Renaissance Art,Hard,Most,"Filippo Brunelleschi designed and engineered the dome of Florence Cathedral, the largest dome constructed since antiquity."
131,Renaissance Art,Hard,Most,The humanist writer Francesco Petrarca is considered an early influence on the Italian Renaissance.
132,Renaissance Art,Hard,Most,Andrea Mantegna incorporated rigorous linear perspective in his painting The Dead Christ.
133,Renaissance Art,Hard,Most,Rogier van der Weyden popularized the diptych format in paintings like his Descent from the Cross.
134,Renaissance Art,Hard,Most,Titian pioneered a brushstroke technique called alla prima to achieve atmospheric effects.
135,Renaissance Art,Hard,Most,Sofonisba Anguissola was one of the first well-known female Renaissance painters.
136,Renaissance Art,Hard,Most,Jan Gossaert made an important contribution to Renaissance art by introducing elements of Italian classicism into Northern art.
137,Renaissance Art,Hard,Most,Hans Holbein the Younger is renowned for his realistic portraits of figures like Henry VIII.
138,Renaissance Art,Medium,Fairly,"Sandro Botticelli's famous painting ""The Birth of Venus"" depicts the Roman goddess Venus emerging from the sea on a giant seashell."
139,Renaissance Art,Medium,Fairly,"Michelangelo's sculpture of David was originally intended to sit atop the cathedral in Florence, Italy."
140,Renaissance Art,Medium,Fairly,Jan van Eyck was a Flemish painter who pioneered the use of oil paints in the early Renaissance period.
141,Renaissance Art,Medium,Fairly,Leonardo da Vinci actually completed and unveiled his famous mural The Last Supper during his lifetime.
142,Renaissance Art,Medium,Fairly,Raphael was a master of perspective and anatomical realism but never painted any portraits.
143,Renaissance Art,Medium,Fairly,Donatello is famous solely for his sculptures and never worked in any other medium.
144,Renaissance Art,Medium,Fairly,The Arnolfini Portrait by Jan van Eyck depicts a couple getting married.
145,Renaissance Art,Medium,Fairly,The School of Athens by Raphael contains no identifying portraits of philosophers.
146,Renaissance Art,Medium,Fairly,Titian pioneered a brushwork technique called chiaroscuro that used strong contrasts between light and dark.
147,Renaissance Art,Medium,Fairly,Giotto's frescoes in the Scrovegni Chapel contained only biblical scenes and no depictions of contemporary life.
148,Renaissance Art,Medium,Fairly,The Mona Lisa by Leonardo da Vinci is painted on canvas using oil paints.
149,Renaissance Art,Medium,Fairly,Michelangelo's David sculpture is made entirely of bronze.
150,Renaissance Art,Medium,Fairly,The Medici family were important patrons of Renaissance artists in Florence.
151,Renaissance Art,Medium,Fairly,"Jan Van Eyck's ""Arnolfini Portrait"" contains a small dog in the foreground."
152,Renaissance Art,Medium,Fairly,Raphael was born and died in the same year as Michelangelo.
153,Renaissance Art,Medium,Fairly,Sandro Botticelli often painted mythological and allegorical subjects.
154,Renaissance Art,Medium,Fairly,"Donatello's sculpture ""David"" wears a feathered hat."
155,Renaissance Art,Medium,Fairly,Titian was known for his unique use of color and brushstrokes.
156,Renaissance Art,Medium,Fairly,Giotto incorporated extensive use of gold leaf in his fresco paintings.
157,Renaissance Art,Medium,Fairly,Perspective techniques were rarely used by Renaissance artists.
158,Renaissance Art,Easy,Least,Leonardo da Vinci was an Italian Renaissance polymath best known for his paintings such as the Mona Lisa and The Last Supper.
159,Renaissance Art,Easy,Least,"Michelangelo was an Italian sculptor, painter, architect and poet of the High Renaissance."
160,Renaissance Art,Easy,Least,Raphael was an Italian painter and architect of the High Renaissance.
161,Renaissance Art,Easy,Least,Sandro Botticelli was an Italian painter of the Early Renaissance best known for works like The Birth of Venus and Primavera.
162,Renaissance Art,Easy,Least,Jan van Eyck was an Early Netherlandish painter active in Bruges.
163,Renaissance Art,Easy,Least,"Albrecht Dürer was a German painter, printmaker and theorist of the German Renaissance."
164,Renaissance Art,Easy,Least,Titian was an Italian painter and one of the most important members of the 16th-century Venetian school.
165,Renaissance Art,Easy,Least,El Greco was a Greek artist who lived and worked in Spain.
166,Renaissance Art,Easy,Least,Donatello was an Italian sculptor of the Early Renaissance who worked in Florence.
167,Renaissance Art,Easy,Least,Pieter Bruegel the Elder was a Netherlandish Renaissance painter.
168,Renaissance Art,Easy,Least,The Renaissance period began in the 14th century and lasted until the 17th century.
169,Renaissance Art,Easy,Least,Perspective was an important artistic innovation of the Renaissance that created depth and dimension on flat surfaces.
170,Renaissance Art,Easy,Least,"Fresco painting, using pigments on wet plaster, was a popular Renaissance art technique, especially for wall paintings."
171,Renaissance Art,Easy,Least,"Oil paint became widely used during the Renaissance, allowing artists to create textures and details not possible with tempera paint."
172,Renaissance Art,Easy,Least,"Renaissance art had a heavy influence from classical Greek and Roman art and focused on humanism, nature, proportion and balance."
173,Renaissance Art,Easy,Least,Religious themes and biblical events were very common subjects in Renaissance art.
174,Renaissance Art,Easy,Least,"Portraiture flourished in the Renaissance as artists experimented with poses, lighting, and expressions to capture personality."
175,Renaissance Art,Easy,Least,"Renaissance architecture featured order, symmetry, proportions, and mathematical ratios as seen in domes, columns, and arches."
176,Renaissance Art,Easy,Least,"Contrapposto, an asymmetric relaxed pose, was an artistic innovation that lent dynamism and movement to Renaissance sculptures."
177,Renaissance Art,Easy,Least,"Sfumato, a painting technique developed by da Vinci, used subtle gradients between tones to achieve highly realistic images."
178,Machine Learning,Hard,Most,Convolutional neural networks are a type of feedforward artificial neural network that have convolutional layers to filter inputs for useful features.
179,Machine Learning,Hard,Most,The softmax function is used in the output layer of classifiers to normalize outputs into probability distributions.
180,Machine Learning,Hard,Most,"In reinforcement learning, the Bellman equation computes the expected long-term reward for taking an action in a given state."
181,Machine Learning,Hard,Most,Support vector machines find the maximum margin hyperplane between classes by solving a convex quadratic programming optimization problem.
182,Machine Learning,Hard,Most,"Generative adversarial networks consist of two neural networks, a generator and a discriminator, that compete against each other during training."
183,Machine Learning,Hard,Most,Pretraining an artificial neural network by greedily training each layer one at a time is called supervised pretraining.
184,Machine Learning,Hard,Most,"The no free lunch theorem states that averaged over all possible problems, all machine learning algorithms have identical performance."
185,Machine Learning,Hard,Most,Multi-armed bandits allow online learning systems to balance exploiting current knowledge and exploring for new information.
186,Machine Learning,Hard,Most,Bagging models like random forests reduce overfitting by training each model on a random subset of the training data.
187,Machine Learning,Hard,Most,The bias-variance tradeoff refers to balancing underfitting and overfitting in machine learning models.
188,Machine Learning,Hard,Most,"In k-means clustering, the algorithm iteratively updates cluster centroids to reduce the within-cluster sum-of-squares."
189,Machine Learning,Hard,Most,The forget gate in a long short-term memory (LSTM) network controls how much information is retained or forgotten at each timestep.
190,Machine Learning,Hard,Most,Principal component analysis is an unsupervised dimensionality reduction technique that finds a new basis that maximizes variance.
191,Machine Learning,Hard,Most,Thompson sampling balances exploration and exploitation in reinforcement learning by sampling actions from a probability distribution.
192,Machine Learning,Hard,Most,"Autoencoders are neural networks trained to reconstruct their inputs, useful for learning representations of data."
193,Machine Learning,Hard,Most,Gradient boosting improves the predictions of weak learners like decision trees by iteratively focusing on misclassified examples.
194,Machine Learning,Hard,Most,"In linear regression, L1 regularization helps prevent overfitting by penalizing the absolute size of model coefficients."
195,Machine Learning,Hard,Most,The receiver operating characteristic (ROC) curve visualizes the tradeoff between true and false positive rates for binary classifiers.
196,Machine Learning,Hard,Most,Probabilistic graphical models like Bayesian networks compactly represent multivariate probability distributions.
197,Machine Learning,Hard,Most,Active learning algorithms interactively query users to label new unlabeled examples for model training.
198,Machine Learning,Medium,Fairly,Convolutional neural networks are a type of feedforward artificial neural network that can utilize multidimensional arrays of data.
199,Machine Learning,Medium,Fairly,The k-nearest neighbors algorithm is an instance-based supervised learning technique that can be used for both classification and regression problems.
200,Machine Learning,Medium,Fairly,Support vector machines aim to find a hyperplane in a high-dimensional space that distinctly classifies the data points.
201,Machine Learning,Medium,Fairly,"Decision trees build classification or regression models as a tree structure, with branches representing conjunctions of features leading to conclusions about the target variable."
202,Machine Learning,Medium,Fairly,Naive Bayes classifiers assume strong independence between features and are based on Bayes' theorem of conditional probability.
203,Machine Learning,Medium,Fairly,"Gradient boosting produces a prediction model in the form of an ensemble of weak prediction models, typically decision trees."
